{
  "$schema": "https://json-schema.org/draft/2020-12/schema",
  "$id": "https://github.com/ahmed3bead/teach-me/schemas/learner-profile.schema.json",
  "title": "Teach Me learner profile",
  "type": "object",
  "required": ["version", "profile_id", "consent", "data_governance", "language", "goals"],
  "properties": {
    "version": {"const": "1.0.0"},
    "profile_id": {"type": "string", "minLength": 1},
    "consent": {"const": true},
    "data_governance": {
      "type": "object",
      "required": ["purpose", "consent_recorded_at", "retention_until", "deletion_status"],
      "properties": {
        "purpose": {"type": "string", "minLength": 1},
        "consent_recorded_at": {"type": "string", "format": "date-time"},
        "retention_until": {"type": "string", "format": "date-time"},
        "deletion_status": {"enum": ["active", "deletion-requested", "deleted", "expired"]}
      },
      "additionalProperties": false
    },
    "language": {"description": "Canonical values are ar-MSA and en; ar-EG is a read-compatibility alias.", "enum": ["ar-MSA", "ar-EG", "en"]},
    "goals": {"type": "array", "minItems": 1, "items": {"type": "string", "minLength": 1}},
    "constraints": {"type": "array", "items": {"type": "string"}},
    "demonstrated_abilities": {"type": "array", "items": {"type": "string"}},
    "strategy_observations": {"type": "array", "items": {"type": "object", "required": ["strategy", "context", "outcome"], "properties": {"strategy": {"type": "string"}, "context": {"type": "string"}, "outcome": {"enum": ["helped", "neutral", "failed"]}}, "additionalProperties": false}},
    "group_observations": {"type": "array", "items": {"type": "object", "required": ["pseudonymous_group_id", "subject_category", "strategy", "outcome", "observed_at"], "properties": {"pseudonymous_group_id": {"type": "string", "minLength": 1}, "subject_category": {"type": "string", "minLength": 1}, "strategy": {"type": "string", "minLength": 1}, "outcome": {"enum": ["helped", "neutral", "failed"]}, "observed_at": {"type": "string", "format": "date-time"}}, "additionalProperties": false}}
  },
  "additionalProperties": false
}
